id,source,title,url,teaser,body,report_date,admin_level_1,admin_level_2,admin_level_3,relevance_score,relevance_score_string,distance_km,created_at,updated_at
1,gefluegelnews,100.000 Legehennen wegen Newcastle-Krankheit gekeult,https://www.gefluegelnews.de/article/100000-legehennen-wegen-newcastle-krankheit-gekeult,Outbreak of Newcastle disease in a large commercial poultry farm requiring significant culling and movement restrictions.,"# 100.000 Legehennen wegen Newcastle-Krankheit gekeult

**Nach dem Nachweis der Newcastle-Krankheit auf einem großen Legehennenbetrieb im Landkreis Erding haben die Behörden 100.000 Legehennen töten lassen. Die vorgeschriebenen Maßnahmen greifen weit: Schutz- und Überwachungszonen wurden ausgedehnt, zahlreiche Geflügelhalter stehen nun unter Kontrolle.**

## Virusnachweis auf Großbetrieb

Die ND-Infektion war vergangene Woche auf einer großen Hühnerfarm im Landkreis Erding festgestellt worden. In der Folge ordneten die zuständigen Behörden die Keulung des gesamten Bestands an. Etwa 100.000 Legehennen wurden getötet.

## Schutz- und Überwachungszonen ausgeweitet

Das Landratsamt Erding hatte bereits am Freitag Schutz- und Überwachungszonen eingerichtet. Nun vergrößerte es diese Bereiche deutlich.

In der engeren Schutzzone kontrollieren Veterinäre sämtliche 120 landwirtschaftlichen Betriebe mit Geflügelhaltung. In der erweiterten Überwachungszone prüfen die Behörden weitere Höfe. Der größte Teil des betroffenen Gebiets liegt im Landkreis Erding, kleinere Bereiche betreffen auch die Nachbarlandkreise Landshut und Freising.

Geflügelhalter sollten sich umgehend beim Veterinäramt melden, wenn sie Krankheitssymptome in ihren Beständen beobachten, so der Landkreis.",2026-03-03,,,,6,high,,2026-05-29T09:42:23.262887+00:00,2026-05-29T09:42:23.262887+00:00
2,gefluegelnews,12. Osnabrücker Geflügelsymposium: Richtungsweisend,https://www.gefluegelnews.de/article/12-osnabrucker-geflugelsymposium-richtungsweisend,"The text mentions the disease only in the context of a general industry symposium update, stating it currently appears manageable.","# 12. Osnabrücker Geflügelsymposium: Richtungsweisend

**Die Stimmung war gut auf dem Osnabrücker Geflügelsymposium. Die Nachfrage läuft bei Eiern und bei Geflügelfleisch. Die Geflügelpest scheint beherrschbar. Dennoch fehlt vielen Betrieben der Kompass für die Zukunft: Noch mehr Nachhaltigkeit und Tierwohl sind angesagt, aber der Kostendruck steigt, Personal fehlt und die Politik bietet keinen verlässlichen Rahmen. In Osnabrück gab es einige „Wegweiser“.**

Mit über 300 Teilnehmenden hat das 12. Osnabrücker Geflügelsymposium wieder einmal seine Bedeutung als Branchentreff bewiesen. Gleich zu Beginn gab es ein eindeutiges Bekenntnis zur freien Marktwirtschaft. Es kam von Hans-Peter Goldnick, der vor knapp drei Monaten neu zum Präsidenten des Zentralverbandes der Deutschen Geflügelwirtschaft, ZDG, gewählt wurde.

## Hiesige Betriebe würden gern investieren

Für Goldnick steht außer Frage, dass Marktorientierung oberstes Gebot für die Geflügelbetriebe sein muss. Infolge der positiven Nachfrage bescheinigte er der Eierbranche ein „Investitionsklima, das Spaß macht“. Auch in der Hähnchenmast wollten Betriebe investieren, das Geld dafür sei vorhanden.

Leider würde Unternehmertum hierzulande ausgebremst durch nationale Alleingänge bei Haltungsvorgaben etc. Stallumbauten und -neubauten seien kaum möglich. Angesichts der sehr unterschiedlichen Produktionskosten in der EU forderte Goldnick eine Ausweitung der Herkunftskennzeichnung auf den gerade für Geflügelfleisch wichtigen Außer-Haus-Bereich. Für Importe von außerhalb der EU müssten gleiche Standards gelten wie in der EU. Nur so könne die Wettbewerbsfähigkeit hiesiger Betriebe erhalten bleiben.

## Nachhaltigkeit beinhaltet auch Wirtschaftlichkeit

Der neu gewählte ZDG-Chef betonte, dass die hiesige Geflügelproduktion schon heute mit einer sehr guten Ökobilanz punkte. Die allseits geforderte Nachhaltigkeit umfasse aber auch ökonomische und soziale Aspekte, nur ein ganzheitlicher Ansatz habe Zukunft. Hier sah er aktuell einen sich anbahnenden Paradigmenwechsel in der Politik.

Für das Ziel Nachhaltigkeit bewertete Goldnick die „Europäische Masthuhninitiative“ sehr kritisch: „Wir bräuchten 9.700 Ställe mehr für die gleiche Fleischmenge, wir hätten 25 Prozent mehr CO2-Emissionen und einen um 35 Prozent höheren Wasser- und Futterverbrauch pro Kilogramm erzeugtem Fleisch.“ Das könne nicht nachhaltig sein, so sein klares Statement.

Einen wichtigen Beitrag dazu leisten, dass deutsche Geflügelprodukte wettbewerbsfähig sind gegenüber dem Ausland, soll die neue Herkunftskennzeichnung „5xD“ („Gutes aus deutscher Landwirtschaft“). Entwickelt wurde sie von der ZKHL (Zentrale Koordination Handel-Landwirtschaft), zu der Vertreter der Landwirtschaft und des Lebensmitteinzelhandels gehören. Aldi Nord, Aldi Süd, Edeka, Kaufland, Lidl, Netto, Rewe und Penny saßen mit am Tisch und bieten entsprechende Produkte an.

## Die Eierbranche ist zögerlich bei „5xD

In Osnabrück stellte Peter Jürgens von der ZKHL vor, wie es mit der Markteinführung des Herkunftskennzeichens vorangeht. „5xD“ gibt es aktuell für Schweine-, Rind- und Geflügelfleisch, Obst, Gemüse, Kartoffeln, Milch-/Milchprodukte sowie frische Eier. Alles muss dabei vollständig in Deutschland erzeugt worden sein. Entsprechend gelabelte Produkte gibt es seit vergangenem Herbst im Handel. „5xD“ ist ein freiwilliges Kennzeichen.

Während beim Geflügelfleisch die großen Namen der Branche schon dabei sind bei „5xD“, sieht Jürgens bei den Eiern noch Luft nach oben. Bei Eiern beinhaltet „5xD“, dass auch Schlupf/Brüterei und Junghennenaufzucht in Deutschland stattfinden müssen. Hierfür gibt es eine Übergangszeit bis Anfang 2026. Laut Jürgens ist für „5xD“ eine arbeitsteilige Brut, sprich Vorbrut im Ausland und der spätere Schlupf in Deutschland, nicht akzeptabel. Auch die Geschlechtsbestimmung im Brutei muss in Deutschland erfolgen. Es bleibt abzuwarten, wie sich die Nachfrage nach Eiern „5xD“ entwickelt. Aktuell sind Eier eher Mangelware. Legehennenbetriebe, die teilnehmen wollen, müssen ihre nächsten Junghennen in Deutschland kaufen und ggf. ihre bisherigen Lieferbeziehungen über die Grenze hinweg kappen.

## „5xD“ für deutsche Putenbranche existenziell wichtig

Für Heinz Bosse, Geschäftsführer des Putenvermehrers Moorgut Kartzfehn, steht es außer Frage, dass „5xD“ existenziell wichtig ist: „Wir brauchen das Zeichen unbedingt, nicht nur im Handel. Putenfleisch geht zu einem großen Teil in die Gastronomie und an Großverbraucher. Auch dort muss die Herkunft dranstehen. Wir haben deutlich höhere Produktionskosten als etwa in Polen wegen unserer höheren Standards. Und das Mercosur-Fleisch ist sogar 30 Prozent günstiger. Wir müssen die deutsche Herkunft überall ausloben.“

Weitere Themen in Osnabrück waren das jüngst viel diskutierte „Greifen und Verladen“ von Geflügel. Außerdem ging es um die Nutzung von Daten aus dem Betrieb für den Betrieb. Wer braucht was, womit spart man Arbeitszeit, welche Daten unterstützen das Management? Vom FLI gab es ein Update zur Geflügelpest. In zwei Workshops ging es darum, was die Zucht künftig kann oder soll. Zu diesen spannenden Veranstaltungspunkten aus Osnabrück berichten wir in Kürze an dieser Stelle.

Veranstalter des Osnabrücker Geflügelsymposiums sind die Hochschule Osnabrück und WING („Wissenschaft und Innovation für Nachhaltige Geflügelhaltung“) als Forschungseinrichtung der Tierärztlichen Hochschule Hannover.",2025-02-05,,,,2,low,,2026-05-29T09:42:27.139913+00:00,2026-05-29T09:42:27.139913+00:00
3,gefluegelnews,13. Osnabrücker Geflügelsymposium: Diskussionen um Impfung und Keulung,https://www.gefluegelnews.de/article/13-osnabrucker-geflugelsymposium-diskussionen-um-impfung-und-keulung,The report discusses major outbreaks of HPAI and Newcastle Disease in Germany with significant economic and animal welfare impacts.,"# 13. Osnabrücker Geflügelsymposium: Diskussionen um Impfung und Keulung

**Auch in diesem Jahr kam das Osnabrücker Geflügelsymposium nicht darum herum, sich mit dem Thema Tierseuchen zu befassen: Die Geflügelpest hat im Herbst/Winter für massive Schäden gesorgt. Aktuell ist die Branche zudem in großer Sorge, weil die Newcastle Disease in Deutschland angekommen ist. Eine zentrale Frage: Wie kann das massenhafte Keulen künftig verhindert werden?**

Auf dem 13. Osnabrücker Geflügelsymposium befassten sich gleich mehrere Vorträge mit dem Thema Tierseuchen. Im Fokus: Die beiden Schreckgespenster der Branche, das ist zum einen die hochpathogene Form der Geflügelpest (HPAI), zum anderen die Newcastle Disease (ND). Seit dem 20. Februar 2026 gab es bereits mehrere Ausbrüche in Brandenburg und in Bayern.

**Wie verheerend die Geflügelpest im Herbst/Winter 2025/26 war, machten die Ausführungen von Dr. Christiane Rüben vom Niedersächsischen Landwirtschaftsministerium deutlich. Niedersachsen war das am stärksten betroffene Bundesland. Seit Oktober 2025 bis heute gab es 112 Ausbrüche in geflügelhaltenden Betrieben. Diesen fielen 1,6 Mio. Tiere zum Opfer, sie verendeten oder wurden gekeult.**

## Biosicherheit wurde optimiert

Dr. Christiane Rüben bescheinigte der Praxis, dass es seit der Geflügelpest-Welle von 2016/17 erhebliche Verbesserungen bei der Biosicherheit gegeben habe: „In keinem Ausbruchsbetrieb (Anm.: 2025/26) wurden Mängel in der Biosicherheit festgestellt“, sagte sie. Mit zur weiteren Optimierung bei trägt das verpflichtende Erstellen von Biosicherheits-Managementplänen.

**Wie wichtig Biosicherheit ist, machte auch Prof. Dr. Pia Münster auf dem Symposium deutlich. Sie hat die neu geschaffene Professur „Tierhaltung und Tiergesundheitsmanagement“ an der Hochschule Osnabrück inne. Von den beiden großen Geflügelseuchen kann durchaus auch die Lebensmittelversorgung betroffen sein. Das hat zum Beispiel der Eiermangel im vergangenen Frühjahr in den USA gezeigt. Und ebenso betroffen sein wegen Mängeln in der Biosicherheit kann natürlich die Lebensmittelsicherheit, Beispiel Salmonellen. Klar machte Prof. Münster, dass es an vielen Stellen „noch Luft nach oben gebe“ und auch noch Forschungsbedarf bestehe.**

## Geflügelpest-Impfung weiter im Fokus

Bei ND und HPAI sind neben der Biosicherheit die schnellstmögliche Diagnose und im Seuchenfall eine schnellstmögliche Bestandsräumung die tragenden Säulen der Bekämpfung. In Deutschland besteht zudem Impfpflicht gegen ND. Hinzugekommen ist jetzt auch die -mögliche- Impfung gegen Geflügelpest als weitere Säule der Bekämpfung. In Frankreich werden aktuell Enten geimpft, in den Niederlanden möchte man Legehennen impfen, in Italien Puten.

**Prof. Dr. Timm Harder vom Friedrich-Loeffler-Institut (FLI) wies in Osnabrück noch einmal auf den sehr hohen finanziellen, personellen, labortechnischen und administrativen Aufwand hin, den eine Geflügelpest-Impfung nach heutiger Rechtslage bedeuten würde. Geimpfte Bestände müssten engmaschig überwacht werden. Eine Impfung bedeutet auch nicht, dass sich eine Herde nicht trotzdem einmal infizieren kann und dann gekeult werden muss. Nach wie vor wären zudem Handelsrestriktionen zu erwarten.**

## Praxisprojekt zur Impfung von Gänsen

Und: Die durch Impfung, Überwachung etc. entstehenden erheblichen Kosten müssten auf die Produkte aufgeschlagen werden: „Wären Verbraucher bereit, das zu zahlen?“ fragte er. Dennoch werde daran gearbeitet, das Thema voranzutreiben. So soll möglichst bald ein Feldversuch mit der Impfung von Gänsen starten.

**Dass eine Impfung kein Allheilmittel ist, zeigen die jüngsten Ausbrüche von ND in Deutschland. Wie bei der Geflügelpest kann es trotz Impfung grundsätzlich Infektionen einer Herde geben – die dann nach bestehendem Recht gekeult werden muss. Dies gilt unabhängig davon, ob oder wie stark eine Herde erkrankt ist. ND verursacht bekanntlich gerade bei geimpften Legehennen nicht unbedingt schwere Krankheitsbilder. Dr. Christian Grund vom FLI wies auf die verschiedenen Einflussfaktoren für einen „Impferfolg“ hin, dazu gehört zum Beispiel die Impfstoffdosis, mögliche physiologisch bedingte Impflücken, Applikationsfehler, mögliche Koinfektionen der Tiere etc.**

## Keulungen auch gesellschaftliche Frage

Nach Auffassung von Dr. Timm Harder steht die Beantwortung wichtiger Fragen hinsichtlich ND und Geflügelpest an: Für HPAI gebe es ein Impfsystem in spe, bei ND impfe man seit 30 Jahren, trotzdem gebe es Ausbrüche, die viel Geld kosten: „Können wir uns die Geflügelpest-Impfung leisten? Müssen wir bei einer Infektion keulen?“ Diese Fragen, so der Wissenschaftler, müssten gesellschaftlich entschieden werden. Und: „Wir als Wissenschaftler wollen das Virus auslöschen, dafür ist die Keulung unverzichtbar. Ansonsten verharrt das Virus im Land, und wir müssen dauerhaft mit erhöhten Verlusten und schlechterer Wirtschaftlichkeit rechnen“, argumentierte er.

Vor diesem Hintergrund war ein Geflügelpest-Fall des vergangenen Winters aus der Grafschaft Bentheim interessant. Dr. Christiane Rüben berichtete hierüber. Betroffen war ein Legehennenbetrieb mit zehn Ställen und 436.000 Tieren. Nach einer Risikobewertung entschieden Landkreis und Ministerium, dass nur drei der zehn Ställe geräumt werden mussten. Die anderen Ställe wurden intensiv überwacht, die Hennen infizierten sich nicht, und die Eier konnten in Eiproduktenwerken verwertet werden. Möglich war dieses Vorgehen, weil die Ställe als getrennte seuchenhygienische Einheiten angesehen werden konnten.

## Massenhafte Keulungen verhindern

**So stellt sich die Frage, ob ein solches Vorgehen auch bei von ND betroffenen Betrieben möglich wäre. Klaus Middendorf ist Geschäftsführer der Heidegold Gruppe. Das Unternehmen war mit einem großen Standort in Brandenburg von ND betroffen. Hier mussten mehrere hunderttausend Legehennen gekeult werden - trotz geringer Verluste und wenig Klinik, so Middendorf. Er meldete sich in Osnabrück zu Wort und forderte seine Berufskollegen eindringlich auf, ihre Tiere bestmöglich zu schützen.**

In den Heidegold-Ställen war das Impfregime vor dem Hintergrund der vielen ND-Fälle in Polen angepasst worden. Dennoch war es zu einer Infektion gekommen. Eindringlich appellierte er deshalb außerdem an Wissenschaft und Politik, einen Weg zu finden, Massenkeulungen wie aktuell vorgeschrieben, zu vermeiden. Dazu wäre es wichtig, so die Antwort von Dr. Grund, dass Biosicherheitsmaßnahmen sowohl den Eintrag als auch den Austrag von Virus unterbinden. Hilfreich wäre die schnelle Erkennung eines Infektionsherdes, bevor es zu einem Flächenbrand kommen kann.

## Immens hohe Kosten bei Tierseuchenkassen

Klaus Middendorf wies auf die hohe emotionale Belastung für alle Mitarbeitenden im Falle einer Keulung hin, außerdem auf die kaum noch zu stemmenden Kosten für die Tierseuchenkasse.",2026-05-26,,,,8,high,,2026-05-29T09:42:28.097923+00:00,2026-05-29T09:42:28.097923+00:00
4,gefluegelnews,145 ausgesetzte Mastküken: Leipziger Polizei und Tierheim im Rettungseinsatz,https://www.gefluegelnews.de/article/145-ausgesetzte-mastkuken-leipziger-polizei-und-tierheim-im-rettungseinsatz,The report explicitly states there is no connection between the abandoned chicks and the ongoing avian influenza outbreak in the region.,"# 145 ausgesetzte Mastküken: Leipziger Polizei und Tierheim im Rettungseinsatz

**Die Polizei hat 145 ausgesetzte Mastküken auf einem Feld in Schkeuditz entdeckt – sie wurden gerettet und im Tierheim Leipzig versorgt.**

In Schkeuditz (Landkreis Nordsachsen) sind 145 frisch geschlüpfte Mastküken auf einem Feld ausgesetzt worden. Die Polizei entdeckte die hilflosen Tiere am vergangenen Freitag und übergab sie dem Veterinäramt. Inzwischen werden sie im Tierheim Leipzig versorgt und aufgepäppelt.

## Expertennetzwerk soll die Küken weiter versorgen

Laut Tierheimleiter Michael Sperlich waren die Temperaturen von nur sechs Grad für die wenige Tage alten Küken lebensbedrohlich. Ohne schützendes Federkleid und mit speziellem Futterbedarf könnten Mastküken nur von Fachleuten aufgezogen werden. „Wir stehen in Kontakt mit einem Netzwerk aus Nordrhein-Westfalen, das die Tiere übernimmt. Bis dahin bleiben sie noch einige Tage bei uns“, so Sperlich.

## Halterin ermittelt: Behörden leiten Verfahren ein

Die Polizei konnte die Halterin der Küken ermitteln. Gegen sie wird nun ein Ordnungswidrigkeitsverfahren eingeleitet, da es verboten ist, in Obhut gehaltene Tiere auszusetzen oder sich der Verantwortung für sie zu entziehen.

## Kein Zusammenhang mit Vogelgrippe im Landkreis Leipzig

Ein Zusammenhang mit der aktuellen Geflügelpest im Landkreis Leipzig besteht nach Angaben des Tierheims nicht. Eine Quarantäne oder Untersuchung der Tiere sei daher nicht notwendig.",2025-03-05,,,,2,low,,2026-05-29T09:42:28.975713+00:00,2026-05-29T09:42:28.975713+00:00
5,gefluegelnews,"„3,6 Millionen Euro mehr für die Tierseuchenkasse sind ein Foulspiel gegen Geflügelhalter""",https://www.gefluegelnews.de/article/36-millionen-euro-mehr-fur-die-tierseuchenkasse-sind-ein-foulspiel-gegen-geflugelhalter,"The report discusses the financial impact and policy challenges of managing ongoing avian influenza outbreaks in Lower Saxony, Germany.","# „3,6 Millionen Euro mehr für die Tierseuchenkasse sind ein Foulspiel gegen Geflügelhalter""

**„Dieser Plan kommt ohne Vorwarnung und völlig zur Unzeit. Wir befinden uns mitten in der Bewältigung eines schweren Geflügelpestausbruchs und sollen nun auf den Kosten sitzen bleiben"", kommentierte Niedersachsens Agrarministerin Barbara Otte-Kinast die Mitte September bekannt gewordenen Sparpläne der EU-Kommission, die EU-Kofinanzierung bei Tierseuchenausbrüchen von bislang 50 Prozent auf 30 Prozent zu reduzieren. Die Kürzungen sollen auch rückwirkend für vorangegangene Haushaltsjahre vorgenommen werden. Konkret geht es um rund 3,6 Millionen Euro, die ab 2023 von den Tierhaltern zusätzlich aufgebracht werden sollen.**

„Die EU-Rechnung bedeutet einen weiteren schweren Schlag für unsere Geflügelhaltung, der ihre Existenz bedroht"", sagte Otte-Kinast. Die Ministerin hat sich deshalb in einem Schreiben an Bundesagrarminister Cem Özdemir gewandt und dringend darum gebeten, sich gemeinsam mit Niedersachsen für eine Rücknahme der Brüsseler Entscheidung einzusetzen. Ansonsten entstehe den deutschen Tierhaltern ein erheblicher Wettbewerbsnachteil.

## Mittelgroßer Betrieb mit 10.000 Euro mehr belastet

„In vielen anderen EU-Mitgliedstaaten werden sämtliche Kosten der Bekämpfung von staatlicher Seite bezahlt und nicht aus Tierhalterbeiträgen“, schreibt die Ministerin. „In anderen Mitgliedstaaten treten private Versicherungen mit oder ohne staatliche Beihilfen für die Versicherungsprämien ein. Für einen mittelgroßen Putenbestand (rund 13.000 Tiere) in Niedersachsen bedeutet die Reduktion der EU-Kofinanzierung von 50 auf 30 Prozent künftig eine zusätzliche Belastung von über 10.000 Euro.“

## Unverständliche Verzögerungstaktik der Bundesregierung

Deutliche Unterstützung erwartet Agrarministerin Barbara Otte-Kinast auch von der Bundesregierung bei der Erhöhung der Entschädigung für Zuchtgänse. Im Seuchenfall sollen pro Tier künftig 110 Euro statt bislang 50 Euro gezahlt werden. In der vergangenen Woche hatte das Kabinett den niedersächsischen Änderungsantrag „zum gegenwärtigen Zeitpunkt"" abgelehnt. Begründung: Man wolle ein Notifizierungsverfahren der EU abwarten. „Solche Verfahren dauern bis zu acht Monate. Diese Verzögerungstaktik ist völlig unverständlich, zumal der Bundesrat schon grünes Licht gegeben hat. Ein weiteres Foulspiel gegen unsere Geflügelhalter"", kritisierte Otte-Kinast die Entscheidung.

Gerade Gänsehalter seien von der grassierenden Geflügelpest besonders betroffen, da Gänse aus Tierschutzgründen nicht dauerhaft aufgestallt werden können. „Umso wichtiger ist es, dass die Tierseuchenkasse im Falle eines Seuchenausbruchs auch angemessene Entschädigungen zahlen kann"", so Agrarministerin Barbara Otte-Kinast.",2022-10-06,,,,4,medium,,2026-05-29T09:42:48.635174+00:00,2026-05-29T09:42:48.635174+00:00
