id,source,title,url,teaser,body,report_date,admin_level_1,admin_level_2,admin_level_3,relevance_score,relevance_score_string,distance_km,created_at,updated_at
17,gefluegelnews,Aktuelles Interview: Geflügelhalter in Niedersachsen - Fluch oder Segen?,https://www.gefluegelnews.de/article/aktuelles-interview-geflugelhalter-in-niedersachsen-fluch-oder-segen,"The report discusses a significant outbreak of avian influenza in Lower Saxony, Germany's primary poultry-producing region.","# Aktuelles Interview: Geflügelhalter in Niedersachsen - Fluch oder Segen?

**Niedersachsen ist Geflügelland Nr. 1 in Deutschland. Derzeit ist es aber auch am meisten gebeutelt von der Vogelgrippe – inkl. Diskussionen über Tierdichte, Seuchenverursacher oder die mittlerweile immensen Kosten. Wir sprachen mit Friedrich-Otto-Ripke, dem Vorsitzenden des Landesverbandes der Niedersächsischen Geflügelwirtschaft, NGW.**

## Wie der NGW die aktuelle Geflügelpest-Situation bewertet

### Herr Ripke, Geflügelhalterin oder Geflügelhalter in Niedersachsen zu sein – derzeit eher Fluch oder noch Segen?

Niedersachsen ist nicht nur Spitzenreiter, was die Zahl an Legehennen- und Geflügelmastbetrieben angeht. Es gibt auch sehr wirtschaftskräftige und zukunftsgerichtete vor- und nachgelagerte Unternehmen. Hinzu kommen Einrichtungen, die in der Geflügelforschung führend sind. Insofern bündelt Niedersachsen hier großes Wissen und Innovationskraft. Das sehe ich für die niedersächsischen Betriebe als großen Vorteil.

Das kommt jetzt auch beim Vogelgrippe-Geschehen zum Tragen. So verlegen die Integrationen Schlachttermine vor, um Tiere aus den gefährdeten Regionen herauszunehmen. Oder es gibt Forschungsprojekte zu noch mehr Biosicherheit.

### Niedersachsen ist momentan aber eben auch am meisten gebeutelt von der Vogelgrippe?

Das ist richtig. Aber: Von den bundesweit gehaltenen ca. 160 Mio. Stück Geflügel stehen etwa 106 Mio. in Niedersachsen, also fast zwei Drittel. Von den bisher 110 Ausbrüchen seit Anfang Oktober in Deutschland betreffen 61 Fälle niedersächsische Betriebe. Bezogen auf unseren zahlenmäßigen Bestand sind wir prozentual also nicht stärker betroffen als andere Bundesländer. Es sind aber natürlich sehr viele Tiere, die bei uns vorsorglich getötet werden mussten.

### Der Landkreis Cloppenburg ist wie schon 2021/2022 der Vogelgrippe-Hotspot. Hier gibt es eine hohe Zahl an Putenställen. Wie sehen Sie, dass Landwirtschaftsministerin Miriam Staudte eine Reduzierung der Tierdichte möchte?

Meines Erachtens käme das einem Berufsverbot gleich und das war und ist rechtlich nicht umsetzbar. Ministerin Staudte hat das schon 2021/22 gefordert, als die Vogelgrippe hier ebenfalls massiv gewütet hat. Schon damals gab es von uns u.a. den Vorschlag, Putenställe umzunutzen etwa für die Hähnchenmast. Ein Tierartenwechsel wurde von Ministerin Staudte leider nicht unterstützt.

Aktuell suchen die Hähnchen-Integrationen sogar intensiv nach neuen Ställen. Aber eine Umnutzung/ein Umbau der Ställe ist nach derzeitiger Gesetzeslage kaum möglich, Betriebe würden dann ihren Bestandsschutz verlieren. Hier ist es wichtige Aufgabe der Politik, die Voraussetzungen für Umbaumöglichkeiten zu schaffen. Die Entscheidungshoheit, welche Tiere man halten will, muss aber immer bei der Landwirtin oder beim Landwirt liegen.

### Nach Auffassung des Ministeriums erhöht die hohe Tierdichte bzw. Stalldichte das Risiko von Ausbrüchen. Wie ist Ihre Einschätzung?

Aussage des Friedrich-Loeffler-Instituts (FLI) ist, dass Übertragungen von Stall zu Stall, also Sekundärausbrüche, beim aktuellen Geschehen eher die Ausnahme seien. Meines Erachtens müssen wir abwarten, was die Gensequenzierungen (des Vogelgrippe-Virus) ergeben, die für infizierte Bestände durchgeführt werden müssen. Erst dann kann man sagen, ob es Sekundärausbrüche gibt oder ob, wie derzeit die Regel, Wildvögel das Virus eintragen.

Im Landkreis Cloppenburg gibt es viele Moor- und Wasserflächen mit einer dadurch hohen Wild- bzw. Zugvogeldichte. Das spricht für Wildvogeleinträge.

Im Übrigen hält auch das FLI die Theorie, dass Wildvögel sich durch Virus aus den Ställen infiziert haben, für sehr unwahrscheinlich. Ministerin Staudte und die Tierschutzbeauftragte Julia Pfeiffer-Schlichting sollten deshalb aufhören, die Fakten umzudrehen.

## Impfung gegen Vogelgrippe: Warum der Druck auf Lösungen wächst

### Die Biosicherheit in den Betrieben ist in den vergangenen Jahren massiv hochgefahren worden. Hätte man mehr tun können, das jetzige Geschehen zu verhindern?

Dass die Biosicherheit bei niedersächsischen Betrieben inzwischen top ist, wird uns von verschiedener Seite bescheinigt. Das heißt nicht, dass es kein Optimierungspotenzial mehr gibt. Ich hätte mir im Übrigen gewünscht, dass die Jägerschaft in Niedersachsen schon früher die Erlaubnis gehabt hätte, sichtlich erkrankte Kraniche und damit Virusverbreiter durch Töten zu erlösen. Von unserer diesbezüglichen Anfrage bis zur Genehmigung sind zwei Wochen wertvolle Zeit vergangen.

### Das Thema Impfung als Vorsorge vor der Vogelgrippe rückt wieder verstärkt in den Fokus, was sagen Sie dazu?

Meines Erachtens kommt das Thema sehr zurecht wieder aufs Trapez. Wir diskutieren schon Jahre darüber und sind keinen Schritt weitergekommen. Wir wollen jetzt vom NGW versuchen, eine Feldstudie mit Gänsen anzustoßen. Gänse sind große Tiere, die Freilandhaltung brauchen. Die AI-Impfung ist eine Injektionsimpfung und kommt für sie am ehesten in Frage. Bestehende Handelshemmnisse durch Impfung müssen aber zunächst ausgeräumt werden.

Wir wollen FLI, Tierärztliche Hochschule Hannover, Tierseuchenkasse, Landesministerium etc. mit ins Boot holen. Für eine breite Umsetzung in die Praxis ist dann wieder die Politik gefragt. Unter anderem fordern wir die Unterstützung der Bundesregierung für ein Memorandum der WOAH (World Organisation for Animal Health), dass das Fleisch geimpfter Tiere frei gehandelt werden kann.

### Was sagen Sie Ihren Mitgliedern, die betroffen sind oder um ihre Bestände bangen, wie geht es weiter - nach der Vogelgrippe ist vor der Vogelgrippe?

Eines ist klar: Wir werden das Virus nicht allein mit Politik ausmerzen. Wir müssen gemeinsam mit allen Beteiligten den ganzen Maßnahmenkatalog nutzen. Wir als NGW tragen etwa das Wiedereinstallungsverbot im Landkreis Cloppenburg mit. Es muss gezielt angeordnet werden. Ich erwähnte schon das Umswitchen von Schlachtterminen oder die Analyse der Gensequenzen Wir müssen schnell weitere Ursachenforschung betreiben, und dann daraus Schlüsse ziehen. Für die Zukunft werden auch neue Ansätze wie etwa eine Zuluftfilterung in Putenställen näher zu betrachten sein.",2025-11-21,,,,4,high,,2026-05-29T09:44:24.145347+00:00,2026-05-29T09:44:24.145347+00:00
18,gefluegelnews,Aktuelles zur Tierseuchenversicherung,https://www.gefluegelnews.de/article/aktuelles-zur-tierseuchenversicherung,Widespread H5N1 outbreaks in poultry farms across Germany causing significant economic impact and insurance challenges.,"# Aktuelles zur Tierseuchenversicherung

Seit Herbst 2021 wird bei verendeten Wild- und Zuchtvögeln immer wieder das Geflügelpestvirus H5N1 nachgewiesen - auch Zucht- und Mastbetriebe bleiben davon nicht verschont. In vielen Landkreisen wurde eine Stallpflicht für Legehennen ausgesprochen und diverse Betriebe sind durch die direkten oder indirekten Folgen der Geflügelpest betroffen. Bereits im Vorjahr grassierte die Geflügelpest in Europa und brachte enorme finanzielle Auswirkungen für den Geflügelsektor mit sich.

Eine EU-Verordnung (2020/687) hat die Situation im Vergleich zum Seuchenzug des vorangegangenen Jahres zusätzlich verändert. Demnach ist die Verbringung von Tieren zur Wiedereinstallung in die Sperrzone (Schutzzone, 3 km und Überwachungszone, 10 km) zukünftig beispielsweise nicht mehr zulässig.

In dieser Sache haben wir uns mit dem Versicherungsmakler Diepenbrock aus Lingen unterhalten. Der Versicherungsmakler beschäftigt sich seit 20 Jahren mit dem Thema der Tierversicherungen und betreut für mehr als 1.000 Agrarbetriebe. Neben den Erzeugern gehören auch Brütereien, Kraftfutterhersteller und Verarbeiter zum Kundenkreis des emsländischen Versicherungsmaklers.

Die Tierseuchenkasse kommt nur teilweise für diese Schäden auf, eine ergänzende Tier-Ertragsschadenversicherung kann im Schadensfall existenziell wichtig sein!

Bei der direkten Betroffenheit wird von der Tierseuchenkasse der gemeine Tierwert, nicht aber der Leerstandschaden, entschädigt.

Wenn ein Freilandhalter nach 16 Wochen Stallplicht die Eier auf Bodenhaltung umprinten muss, kommt die Tierseuchenkasse nicht für diesen Schaden auf.

Des Weiteren sind auch verlängerte Leerstandschäden durch Einstallungsverbote nicht gedeckt und sollten zur Liquiditäts- und Existenzsicherung ergänzend versichert werden.Nach Angaben von Thomas Brink, Geschäftsführer des Versicherungsmaklers, kann für diese Szenarien bei mehreren Versicherern ein Versicherungsschutz vereinbart werden: „Als freier und unabhängiger Ansprechpartner bieten wir jedem Geflügelhalter an, dass wir die vorhandenen Versicherungslösungen am Markt prüfen und objektiv miteinander vergleichen. Das gilt sowohl für Neuanfragen als auch für bestehende Deckungen. Die Angebote sind vielfältig und häufig steckt der Teufel im Detail. Neben der eigentlichen Seuchenversicherung bieten die Versicherer weiteren Deckungsschutz, beispielsweise auch für Salmonellen oder Fipronil & Dioxin an. Wir können die Betriebe nur motivieren, sich mit diesem Thema auseinanderzusetzen. Im gemeinsamen Gespräch erarbeiten unsere Mitarbeiter/innen ein betriebsindividuelles Konzept für jeden Betrieb. Diese Dienstleistung ist kostenlos und unverbindlich.“

Aufgrund der hohen Fallzahl der Schäden und den damit verbundenen gestiegenen Schadenszahlungen rechnen die Agrar-Kundenbetreuer Jannis Schulz und Thomas Berling perspektivisch mit erhöhten Prämien: „Aktuell zeigt sich am Markt ein restriktives Zeichnungsverhalten der Versicherer. In einigen Regionen und Geflügelhochburgen können wir neuen Interessenten derzeit überhaupt keinen oder nur einen eingeschränkten Versicherungsschutz anbieten. Des Weiteren werden beispielsweise die Verträge der schadenbelasteten Betriebe angepasst. Das kann eine Prämienerhöhung, aber auch eine Reduzierung des Versicherungsschutzes oder sogar eine Vertragskündigung mit sich bringen. Wir beobachten den Markt und werden unseren Kunden weiterhin den bestmöglichen Versicherungsschutz anbieten. Bei Fragen zu diesem Thema steht das gesamte Agrar-Team unseren Kunden und neuen Interessenten mit Rat und Tat zur Seite.“

Im Schadensfall begleitet der Versicherungsmakler Diepenbrock die betroffenen Betriebe und unterstützt diese bei der Schadensregulierung.

Die Agrarkundenbetreuer haben „Stallgeruch“ und sprechen die Sprache der Kunden, beispielsweise sind im 10-köpfigen Team ein gelernter Landwirt und ein Agraringenieur tätig. Diese haben sich durch einen weiteren Ausbildungsgang auf das Thema der Agrarischen Versicherungen spezialisiert.

Auch zukünftig werden nach Meinung Versicherungsmaklers Deckungen angeboten werden, die allerdings immer betriebsindividueller werden und die Situation in der Region und die Risikoverhältnisse auf dem Betrieb berücksichtigen. Ein unabhängiger Vergleich wird immer wichtiger und kann gegebenenfalls bares Geld sparen.",2022-04-04,,,,4,high,,2026-05-29T09:44:25.101250+00:00,2026-05-29T09:44:25.101250+00:00
19,gefluegelnews,Alarm in Grafschaft Bentheim: Vogelgrippe bedroht Millionen Tiere,https://www.gefluegelnews.de/article/alarm-in-grafschaft-bentheim-vogelgrippe-bedroht-millionen-tiere,Highly pathogenic H5N1 outbreak in a high-density poultry farming region with 2.3 million birds at risk.,"# Alarm in Grafschaft Bentheim: Vogelgrippe bedroht Millionen Tiere

**In einem Legehennenbetrieb im Landkreis Grafschaft Bentheim (Niedersachsen) wurde am 24. Januar 2025 die Geflügelpest festgestellt. Die 30.000 Tiere wurden tierschutzgerecht getötet. Der Landkreis ist in Alarmbereitschaft: In der Schutz- und Überwachungszone um den Betrieb befinden sich 300 Geflügelbetriebe mit 2,3 Mio. Tieren.**

Bei dem von der Geflügelpest betroffenen Legehennenbetrieb in der Grafschaft Bentheim unweit der Grenze zu den Niederlanden wurde vom Friedrich-Loeffler-Instituts (FLI) die hochpathogene Aviäre Influenza (HPAI) vom Subtyp H5N1 bestätigt.

Im betroffenen Betrieb hatten zuvor zahlreiche Tiere Geflügelpest-typische Symptome gezeigt, etliche Tiere waren zudem verendet. Zur Bekämpfung der hochansteckenden Virus-Infektion wurde rund um den Ausbruchsbetrieb eine Schutzzone mit einem Radius von drei Kilometern sowie eine Überwachungszone mit einem Radius von zehn Kilometern eingerichtet. Benachbarte emsländische und niederländische Gemeinden liegen ebenfalls in dieser Zone.

Der Landkreis Emsland ist seitens des Grafschafter Veterinäramtes umgehend informiert und in die Seuchenbekämpfung eingebunden worden. Über Landes- und Bundesebene wurden auch die niederländischen Behörden informiert.

## Seuchenbekämpfung: Schutzzone und strikte Maßnahmen für 300 Betriebe

„Der Ausbruch der Geflügelpest in diesem Teil der Grafschaft ist besonders alarmierend, da der betroffene Betrieb inmitten eines Hotspots der Geflügelhaltung liegt. Im Radius von zehn Kilometern befinden sich über 300 Betriebe. Wir sprechen hier von rund 2,3 Millionen gemeldetem Geflügel, das potentiell gefährdet ist“, macht Kreisveterinär Dr. Hermann Kramer deutlich. Die konkreten Zahlen: In der Schutzzone liegen 37 geflügelhaltende Betriebe mit insgesamt rund 385.000 Tieren. Im Bereich der Überwachungszone befinden sich weitere 285 Betriebe mit rund 1,9 Millionen Tieren.

Innerhalb der beiden Zonen gelten strenge Seuchenbekämpfungsmaßnahmen, um einer Verbreitung des Virus und damit verbundenen wirtschaftlichen Schäden vorzubeugen. So ist u.a. die Teilausstallung von Geflügel in beiden Zonen untersagt. In der Schutzzone und der Überwachungszone ist zudem jeglicher Transport von lebendem Geflügel, Eiern und weiteren Erzeugnissen verboten. Weiterhin wurde die Aufstallung des Geflügels in den beiden Restriktionszonen verfügt.

## Appell an Landwirte: Biosicherheitsmaßnahmen sind entscheidend

Kreisveterinär Kramer appelliert an die Geflügelhalterinnen und -halter, die Biosicherheitsmaßnahmen auf den Betrieben unbedingt einzuhalten. Wer Auffälligkeiten bemerkt – beispielsweise eine verminderte Futter- und Wasseraufnahme der Tiere, vermehrte Todesfälle im Tierbestand oder andere klinische Symptome – sollte umgehend das Veterinäramt des Landkreises informieren.

## Untersuchung von Betrieben in Schutzzone

Die Ursache des Geflügelpest-Ausbruchs steht derzeit noch nicht fest, epidemiologische Untersuchungen dazu laufen. Die Tierärztinnen und Tierärzte des Veterinäramtes haben zudem bereits am Donnerstag damit begonnen, die Betriebe im Umkreis von drei Kilometern um den betroffenen Betrieb zu untersuchen und zu beproben.

Auch das gemeinsame Tierseuchen-Logistikzentrum der Landkreise Emsland und Grafschaft Bentheim hat seinen Betrieb aufgenommen. Dort werden die tierärztlichen Untersuchungsteams mit Material ausgerüstet, Proben entgegengenommen sowie Ausrüstung und Fahrzeuge gereinigt und dekontaminiert. Diese Aufgabe übernehmen Ehrenamtliche des Ortsverbands Nordhorn des Technischen Hilfswerks mit einer eigens eingerichteten Dekontaminationsanlage.",2025-01-27,,,,8,high,,2026-05-29T09:44:26.953598+00:00,2026-05-29T09:44:26.953598+00:00
20,gefluegelnews,"„Alles, was wir tun, muss etwas bringen“",https://www.gefluegelnews.de/article/alles-was-wir-tun-muss-etwas-bringen,"The text mentions avian influenza only as a potential risk factor for a farm due to nearby wild birds, not as an active outbreak.","# „Alles, was wir tun, muss etwas bringen“

**Bert de Bruijckere, Hähnchenmäster und Ackerbauer im niederländischen Zeeuws-Vlaanderen, blickt voraus und sorgt dafür, dass sein Betrieb mit 1-Stern Beter Leven-Masthähnchen, Sonnenkollektoren, Holzofen und Feinstaubreduzierung durch Ionisierung sowie einem eigenen Kreislauf auf dem neuesten Stand ist.**

Bert de Bruijckere bezeichnet sich selbst als wirtschaftlichen Landwirt. ""Alles, was wir tun, muss etwas bringen: weniger Feinstaub, bessere Tiergesundheit, geringerer Fußabdruck, mehr Arbeitszufriedenheit und Euro"", sagt der 37-jährige Unternehmer. Er bewirtschaftet den Hof gemeinsam mit seiner Frau Rosalien und seinen Eltern Walter und Fien. Bei der Bewirtschaftung der großen Ackerfläche werden sie von zwei Festangestellten und flexiblen Arbeitskräften unterstützt.

Auf dem Betrieb sind Bert und Walter schwerpunktmäßig mit dem Ackerbau beschäftigt, Rosalien macht die Verwaltung, Fien kümmert sich um die Küken. Die Selektion der Pflanzkartoffeln hat bereits begonnen. Auf dem seeländischen Lehm ist auch eine Bewässerung notwendig. ""Wir bewässern, wo immer es möglich ist. Es ist schwierig, gutes Wasser hochzupumpen, es ist oft zu salzig"", erklärt der Ackerbauer und Geflügelzüchter. Eines seiner aktuellen Projekte ist der Bau von achtzehn Wasserbecken. ""Mit diesen Becken, die jeweils größer als ein Hektar sind, wollen wir Wasser für die Bewässerung sammeln. Damit wollen wir etwas gegen die Dürreprobleme tun.“ Das Becken ist auch als Löschwasser gedacht.

## Übergang zu 1-Stern Better Leven

1988 begannen Fien und Walter mit einem Stall für 20.000 Masthähnchen. Im Jahr 1995 wurde dieser Stall erweitert und im Jahr 2002 wurde ein zweiter Stall für 55.000 Masthähnchen gebaut. Bert: ""Als ich 2007 mein Studium abschloss, starteten wir mit dem Genehmigunsgverfahren für einen dritten Stall. Das war ein langer Prozess, der schließlich im Jahr 2014 umgesetzt werden konnte.“ Der Futtermittellieferant De Heus habe ihn gebeten, auf so genannte Konzepthühner für das 1-Stern-Better-Leven-Systemumzustellen. Die Idee gefiel und so baute De Bruijckere einen überdachten Auslauf zu den Ställen 2 und 3. ""Unser Ziel ist es, rentable Hühner zu halten und das zu produzieren, was der Markt verlangt. Die Nachfrage nach 1-Stern-Better-Leven-Hühnern ist gestiegen, und darauf setzen wir“, sagt er.

## Gute Geschichte

Die Haltung von Hubbard JA757 Star-Küken sei einfach und das Huhn sei kräftig, sagt Bert. Die Sterne-Küken bekommen bei ihm täglich Getreide gestreut. Das Tränkesystem wird mehrmals am Tag automatisch durchgespült. Die Reinigung wird von einer externen Firma übernommen.

Der Trend, weniger Hühner pro Quadratmeter zu halten, hält an, weiß der Landwirt. ""Früher waren es in den Niederlanden 12 Hühner pro Quadratmeter. Jetzt gehen wir auf neun zu, weil wir sonst über 25 Kilo pro Quadratmeter kommen. Wir würden gerne einen weiteren Stall bauen, um die gleiche Anzahl Tiere wie heute auch in Zukunft zu halten. Der Antrag liegt vor. Ich denke, dass unsere Geschichte gut ist: mehr Tierschutz und Beibehaltung der Rentabilität"", sagt De Bruijckere. Hygiene ist ein Schwerpunkt auf dem Betrieb: So wenig Menschen wie möglich sollen die Ställe betreten und saubere Stiefel beim Betreten des Stalls sind eine Selbstverständlichkeit. Es gibt nur wenige andere Geflügelfarmen in der Gegend, aber das Landschaftsschutzgebiet in der Nähe des Betriebs macht der Familie Sorgen. ""Dort gibt es eine Menge Vögel. Sie stellen ein Risiko für die Einschleppung der Vogelgrippe dar.""

## Feinstaubreduzierung

Als Bert de Bruijckere die Ausschreibung für das Projekt zur Feinstaubreduzierung durch Ionisierung sah, meldete er sich sofort an. Die Firma Serutech Agri installierte daraufhin in den drei Ställen des Landwirts das System DUSTion – ein Ionisierungssystem. Dabei werden Feinstaubpartikel statisch aufgeladen und lagern sich dann im Stall ab. Für die richtige Ionisierung sind feste Punkte erforderlich, an denen eine Hochspannung anliegt, der so genannte Koronadraht. Dieser Draht verläuft einen halben Meter unter der Decke und ist an einen regelbaren Hochspannungsgenerator mit einer hohen Ausgangsspannung von 20.000 Volt angeschlossen. Durch die Ionisierung werden die Staubpartikel statisch aufgeladen und fallen dann aus. Das Ergebnis ist eine 52-prozentige Reduzierung des Feinstaubs.

""Die Kosten betrugen etwa 10 Euro pro Quadratmeter“, sagt De Bruijckere. „Es fallen keine Wartungskosten an und der Energieverbrauch ist gering.“ Er hat die Erfahrung gemacht, dass der Stall bei Nutzung des Systems viel heller aussieht und er ist mit dem System zufrieden. ""Weniger staubige Ställe sind sowohl für die Gesundheit der Tiere als auch für die Menschen besser. Ein Nachteil ist der Staub an Wänden und Decke. Das erfordert mehr Reinigungsarbeit: erst muss der trockene Staub weggeblasen werden und dann wird nass gereinigt.""

## Halbierung der Heizkosten

Auf den Dächern der Hähnchenställe des niederländischen Landwirts befinden sich 1.300 Sonnenkollektoren, die das gesamte Unternehmen mit Strom versorgen. 2015 investierte De Bruijckere in einen Biomasse-Holzofen von Herz, der mit Holzspänen befeuert wird. Der zentrale Heizkessel beheizt den gesamten Betrieb, das Kartoffellager und die Zwiebeltrocknung. Auch das neue gasfreie Haus, das Bert und Rosalien gebaut haben, ist daran angeschlossen. ""Vorher haben wir mit Propan geheizt. Mit dem neuen System haben sich die Heizkosten halbiert“, sagt De Bruijckere.",2023-08-07,,,,1,low,,2026-05-29T09:44:38.115775+00:00,2026-05-29T09:44:38.115775+00:00
21,gefluegelnews,Am Getreidemarkt bleibt es turbulent,https://www.gefluegelnews.de/article/am-getreidemarkt-bleibt-es-turbulent,"The text discusses market turbulence and supply chain issues related to the Ukraine war, not a biological disease outbreak.","# Am Getreidemarkt bleibt es turbulent

„Könnt Ihr überhaupt noch liefern?“, wird Martin Kock, Einkäufer bei der Firma TiBA Kraftfutter, seit Ausbruch des Ukraine-Krieges oft gefragt. Das ist für den Experten, der seit elf Jahren im Geschäft ist, neu. Zum Glück seien einige kurzfristig geschlossene Transportwege jetzt wieder offen, sagt Martin Kock. Dazu zählen die Bahntransporte. „So bekommen wir jetzt den Mais als Bahnware.“ Trotzdem sitzt den Unternehmen die Angst im Nacken, dass alle Warenströme wieder zu Erliegen kommen könnten.",2022-05-26,,,,1,low,,2026-05-29T09:44:44.495466+00:00,2026-05-29T09:44:44.495466+00:00
