id,source,title,url,teaser,body,report_date,admin_level_1,admin_level_2,admin_level_3,relevance_score,relevance_score_string,distance_km,created_at,updated_at
12,gefluegelnews,"AGRAR Unternehmertage 2026 in Münster: 25.000 Besucher, klare Signale für Stallumbau und Zukunftsstrategien",https://www.gefluegelnews.de/article/agrar-unternehmertage-2026-in-munster-25000-besucher-klare-signale-fur-stallumbau-und-zukunftsstrategien,The text describes a trade fair for agriculture and does not report an actual disease outbreak.,"# AGRAR Unternehmertage 2026 in Münster: 25.000 Besucher, klare Signale für Stallumbau und Zukunftsstrategien

**Vier Tage lang wurde in Münster diskutiert, geplant und verhandelt: Die AGRAR Unternehmertage 2026 zogen rund 25.000 Besucher an. Im Mittelpunkt standen Stallumbau, Tiergesundheit, Vermarktung und die Zukunft der Schweinehaltung. Die nächsten AGRAR Unternehmertage finden vom 1. bis 4. Februar 2028 statt.Die AGRAR Unternehmertage 2026 sind am Freitag mit positiver Bilanz zu Ende gegangen. Rund 25.000 Besucher kamen an vier Messetagen ins Messe und Congress Centrum Halle Münsterland. Damit lag die Veranstaltung leicht über dem Niveau von 2024. Auch NRW-Landwirtschaftsministerin Silke Gorißen besuchte die Messe und unterstrich deren Bedeutung für die Branche.**

## Der direkte Austausch stand im Mittelpunkt

Die Messe setzte erneut auf direkte Gespräche statt große Inszenierung. Landwirte, Berater, Unternehmen, Verbände und Politik nutzten die Plattform, um über Tierhaltung, Vermarktung, Energie, Digitalisierung und Betriebsentwicklung zu sprechen. Viele Aussteller gestalteten ihre Stände bewusst offen – mit Sitzgruppen statt Verkaufstheken.

## Informationen zu Stallumbauten gefragt

Besonders stark nachgefragt waren Informationen zu Stallumbauten, neuen Haltungsformen und gesetzlichen Vorgaben. Im Schweinesektor spürten viele Aussteller Unsicherheit. Gleichzeitig suchten zahlreiche Betriebe Orientierung für Investitionen und künftige Strategien. Vor allem die Haltungsform 3 spielte dabei eine zentrale Rolle.

## Tiergesundheit rückt stärker in den Fokus

Auch Tiergesundheit und Biosicherheit standen hoch im Kurs. Besucher informierten sich über Impfstrategien, Monitoring und Bestandsbetreuung. Auffällig war der hohe Anteil junger Menschen und Auszubildender, die gezielt Fachgespräche suchten.

Ein weiterer Schwerpunkt lag auf der Rolle von Frauen in der Landwirtschaft. Im Rahmen des Ehrenamtstages diskutierten Teilnehmerinnen über Hofnachfolge, finanzielle Absicherung und neue Betriebsmodelle.

## Positive Stimmung trotz Herausforderungen

Trotz unsicherer Marktlage beschrieben viele Aussteller die Atmosphäre als konstruktiv. Zahlreiche Betriebe wollen investieren und ihre Höfe weiterentwickeln – auch wenn das Jahr 2026 wirtschaftlich anspruchsvoll bleiben dürfte.

**Die nächsten AGRAR Unternehmertage finden vom 1. bis 4. Februar 2028 statt.**",2026-02-09,,,,1,low,,2026-05-29T09:43:27.062082+00:00,2026-05-29T09:43:27.062082+00:00
13,gefluegelnews,AI-Impfdurchbruch: Keine Überraschung für die Wissenschaft,https://www.gefluegelnews.de/article/ai-impfdurchbruch-keine-uberraschung-fur-die-wissenschaft,"The report discusses vaccine breakthrough infections in a major poultry-producing European country, impacting regional disease control strategies.","# AI-Impfdurchbruch: Keine Überraschung für die Wissenschaft

**Manchen Geflügelhalter schreckte die Meldung auf: In Frankreich haben sich gegen die Geflügelpest geimpfte Enten infiziert. Für die Wissenschaft ist das aber keine Überraschung. Die Impfung bietet keinen absoluten Schutz. Ihr Zweck ist, Infektionen und Übertragungen zu reduzieren.**

Frankreich ist in den vergangenen Jahren sehr stark von der Geflügelpest (Aviäre Influenza, AI) betroffen gewesen. Insbesondere traf es Betriebe mit der dort weit verbreiteten Entenmast. Das sorgte für immense wirtschaftliche Schäden. Deshalb hat Frankreich im vergangenen Herbst mit einer großangelegten Kampagne zur Impfung von Enten gegen die Geflügelpest begonnen.

In bislang zwei teilnehmenden Betrieben gab es jetzt trotz Impfung eine Infektion. Die Bestände mussten geräumt werden. Nicht überrascht von dem vermeintlichen „Impfdurchbruch“ ist Prof. Dr. Martin Beer, Leiter des Instituts für Virusdiagnostik und Vizepräsident des Friedrich-Loeffler-Instituts (FLI) auf der Insel Riems.

## AI-Impfung ist kein absoluter Schutz

„Die Impfung ist kein 100prozentiger Schutz gegen eine Infektion,“ erläutert er. Sie verfolge das Ziel, Infektionen und in Folge Übertragungen auf andere Tiere oder Betriebe zu reduzieren. „Durch die Geflügelpest-Impfung wird die Empfänglichkeit für eine Infektion mit Feldvirus drastisch reduziert. Wenn aber von außen eine ausreichende Feldvirus-Last in einen Betrieb getragen wird oder zum Zeitpunkt des Eintrages die Immunität nicht mehr oder noch nicht voll ausgeprägt ist, kann es trotzdem zu einer Infektion bei geimpften Tieren kommen. So ist es jetzt in Frankreich passiert,“ sagt der Wissenschaftler.

Diese geimpften und trotzdem mit Feldvirus infizierten Tiere scheiden aber in der Regel deutlich weniger Feldvirus aus als ihre ungeimpften Artgenossen. Die Gefahr einer Weiterverbreitung zum Beispiel zu nahegelegenen Nachbarbetrieben wird so deutlich reduziert. Trotzdem müssen diese Betriebe aber in jedem Fall zur Risikominimierung geräumt werden.

In Frankreich gab es bei den großen Geflügelpest-Zügen der vergangenen Jahre viele Sekundärinfektionen. Dort ist die Entenmast räumlich stark konzentriert, ähnlich wie etwa die Geflügelmast im Nordwesten Niedersachsens. Eine präventive Impfung könnte „Flächenbrände“ der AI, wie es sie in den Vorjahren gab, verhindern.

## Impfstofftestung in mehreren EU-Ländern

Mehrere Länder führen Labortestungen von Geflügelpestimpfstoffen durch, so zum Beispiel die Niederlande, Italien und auch Deutschland. Hierbei soll die Leistungsfähigkeit verschiedener Impfstoffkonzepte an verschiedenen Geflügelarten näher untersucht werden. In Deutschland (am FLI) werden Impfstoffe derzeit vergleichend an Gänsen getestet.

Werden Geflügelpestimpfstoffe im Feld eingesetzt, ist laut EU eine sehr engmaschige Überwachung der geimpften Bestände vorgeschrieben. Diese engmaschige Überwachung ist sehr zeit- und kostenaufwändig und wird deshalb neben den möglichen Handelsrestriktionen als ein weiteres Hemmnis bei der Umsetzung von AI-Impfungen in großem Maßstab diskutiert.

Prof. Dr. Martin Beer: „Wir sind, was die wissenschaftliche Arbeit bezüglich AI angeht, sehr gut vernetzt in der EU. Wir lernen jetzt durch die Impfversuche sehr viel, auch was die besten Überwachungsmaßnahmen sein können, wie man sie am besten umsetzen kann. Das ist sehr wichtig für die Weiterentwicklung einer guten Impfstrategie.“

## Impfung nur ein Baustein von mehreren

Der FLI-Experte betont, dass die Impfung nur als ein Baustein von mehreren in der Vogelgrippe-Bekämpfung gesehen werden kann. Unter bestimmten Begebenheiten und der Gefahr einer hohen Zahl von Sekundärausbrüchen in sehr geflügeldichten Gebieten sei die bisherige Bekämpfungsstrategie mit dem Fokus Früherkennung, Biosicherheit und Räumung der Bestände unter Umständen nicht mehr ausreichend. Die Vogelgrippe ist endemisch geworden in der Wildvogelpopulation, so dass der Infektionsdruck groß ist und die Gefahr von Einträgen in kommerzielle Geflügelhaltungen dadurch über das ganze Jahr hinweg erheblich erhöht wurde. Um fortlaufende Massentötungen von Geflügel zu verhindern und nicht zuletzt wegen der hohen Kosten, die mit der Tötung infizierter Bestände verbunden ist, will auch die EU inzwischen auf die Impfung als weitere Präventivmaßnahme setzen.

„Bei allen anderen Maßnahmen - etwa der Früherkennung und Biosicherheit - darf natürlich auf keinen Fall nachgelassen werden,“ mahnt Prof. Dr. Martin Beer. Das Risiko eines Geflügelpest-Eintrags in Bestände wird für Deutschland von seinem Institut nach wie vor als „hoch“ eingeschätzt.",2024-01-15,,,,4,high,,2026-05-29T09:44:14.927521+00:00,2026-05-29T09:44:14.927521+00:00
14,gefluegelnews,AI-Monitoring in Putenbeständen erfolgreich etabliert,https://www.gefluegelnews.de/article/ai-monitoring-in-putenbestanden-erfolgreich-etabliert,The report discusses a significant and recurring threat of highly pathogenic avian influenza to the poultry industry in Germany and Europe.,"# AI-Monitoring in Putenbeständen erfolgreich etabliert

**Mit einem AI-Monitoring ihrer Bestände wappnet sich die Putenbranche gegen die Klassische Geflügelpest. Wie eine aktuelle Studie zeigt, hat sich diese Methode als zuverlässig erwiesen und ist für Putenhalter einfach zu handhaben.**

Es sind nicht mehr nur einzelne Regionen, die von der Aviären Influenza (AI) betroffen sind. Die Seuche trifft mittlerweile Betriebe fast überall in Deutschland, Europa und auch weltweit. Aktuell verzeichnen beispielsweis die USA ein massives Vogelgrippe-Geschehen. Speziell in diesem Frühjahr zeigte sich, dass die AI-Viruslast inzwischen latent über das ganze Jahr bestehen bleibt. Virusfunde bei Wildvögeln gibt es mittlerweile ganzjährig und die Abstände zwischen neuen Meldungen zu AI-Ausbrüchen werden immer kürzer. Die Branche muss sich also wappnen.

## Analyse von Stallmerkmalen und Umgebung

Das Bundesland Niedersachsen verzeichnete im vorletzten Winter 2020/2021 Verluste von 1,2 Mio. Tieren, die aufgrund des AI-Seuchengeschehens getötet werden mussten, davon ca. 714.000 Puten. Nach den massiven Geflügelpest-Verlusten war speziell die Putenwirtschaft gefordert, Vorsorgemaßnahmen zu entwickeln. Um das AI-Seuchengeschehen aufzuarbeiten, bildete sich rund um den NGW (Niedersächsische Geflügelwirtschaft Landesverband) eine Arbeitsgruppe, an der sich Brütereien, Tierärzte, landwirtschaftliche Berater und Putenhalter beteiligten.

Um mögliche Rückschlüsse auf einen Seucheneintrag ziehen zu können, erarbeitet die Arbeitsgruppe ein gemeinsames Papier, einen so genannten Kriterienkatalog, in welchem sie die einzelnen Farmstandorte mit Stallmerkmalen sowie Umwelt- und Umgebungsverhältnissen abbildete. Der Katalog bezieht sich auf den Zeitraum vom 21. Dezember 2020 bis zum 24. März 2021 und umfasst 205 Putenbetriebe in den Landkreisen Cloppenburg und Oldenburg. Berücksichtigt wurden 39 Ausbruchs- und 166 Nichtausbruchsbetriebe. Von der AI betroffen waren in diesem Zeitraum 517.740 Puten.

Im Kriterienkatalog wurden unterschiedliche Merkmale abgefragt, unter anderem die Lage und Umgebung der Betriebe. Zum Beispiel wurde untersucht, ob es Wasserzüge und/oder Feuchtgebiete in Stallnähe gibt. Erfasst wurde auch, ob sich Wildvögel in Stallnähe aufhalten und wie weit die Entfernungen zu anderen geflügelhaltenden Betrieben sind. Es wurde zudem nach der Bauweise und der Lüftung der Ställe gefragt (Offenstall oder geschlossener Stall). Von besonderem Interesse war auch die Tränkesituation: Welche Tränkeform ist in den Ställen verbaut? Wo befinden sich die Tränken im Stall (Außenwand, Stallmitte)?

Abgefragt wurde auch, welche Biosicherheitsmaßnahmen an den Standorten gefahren werden: Gibt es eine Hygieneschleuse vor jedem Stall? Wird vor jedem Stall ein Kleidungswechsel vollzogen? Außerdem wurde untersucht, welches Einstreumaterial verwendet wird, wie das Material vom Außenbereich in den Stall gelangt oder ob es im Stall gelagert wird.

## 30 Prozent Primärausbrüche

Bei der Betriebsanalyse wurde zwischen Primär- und Sekundärausbruchsbetrieben unterschieden. Als Primärausbruch gilt ein Viruseintrag ohne räumliches und zeitliches AI-Geschehen im Vorfeld. Bei Sekundärausbrüchen handelt es sich um einen AI-Eintrag mit räumlichem und zeitlichem AI-Geschehen im Vorfeld. Bei dem AI-Ausbruchsgeschehen 2020/21 wurden 30 Prozent als Primärausbrüche und 70 Prozent als Sekundärausbrüche bestimmt. Das Alter der betroffenen Puten betrug im Mittel bei 15,1 Wochen (Minimum 7 Wochen, Maximum 22 Wochen).

Bei allen Primärausbrüchen waren Zugvögel in Stallnähe angetroffen worden. Zudem war eine Häufung der Ausbrüche bei hofnahen Ställen zu erkennen (75 Prozent). Ebenso war zu sehen, dass bei den Ausbruchsbetrieben überwiegend Glockentränken (Offentränken) verbaut waren. Bei den Sekundärausbrüchen handelte es sich zu 81,5 Prozent um Ställe, die Jalousien verbaut haben. Hierzu muss allerdings ergänzt werden, dass es in der ausgewerteten Region überwiegend Offenställe (Jalousien und Klappen) für die Putenhaltung gibt und eher selten geschlossene Putenställe (mit Zwangsentlüftung). Laut Auswertung waren unter den Ausbruchsbetrieben wenige Betriebe, die vor jedem Stall eine Hygieneschleuse haben und vor jedem Stall einen Kleidungswechsel vollziehen.

## Eintrag durch Wildvögel wahrscheinlich

Ein Geflügelpest-Ausbruch lässt sich nicht immer nur mit einem Grund erklären, meist führen mehrere Ursachen zu einer Infektion. Und auch die ausgewerteten Cluster in der Betriebsdatenerhebung ergeben keinen monokausalen Zusammenhang. Doch in Fachkreisen wird ein Eintrag über Wildvögel als sehr wahrscheinlich angesehen, da die Zugvogelpopulation / Wassergeflügelpopulation erheblich zugenommen hat. Wie das Virus passiv (bewegte Vektoren?) in den Stall gelangt, bleibt jedoch auch durch die Erhebungen unklar.

Festzuhalten ist, dass die Wetterlage im untersuchten Zeitraum einen großen Einfluss auf Sekundärausbrüche von AI hatte. Insbesondere starke Winde, Böen und Sturm trugen dazu bei, dass Virus-belastete Aerosole und andere Partikel von AI-Ausbruchsbetrieben in benachbarte Stallanlagen (zum Beispiel mit offenen Jalousien) eingetragen werden konnten. Trockene Böden, beispielsweise Sandböden, auf nicht bewachsenen Flächen bieten dem Virus eine Grundlage, mit dem Wind weitergetragen zu werden. Hohe Niederschlagsmengen in den Wintermonaten verringern dagegen die Staublasten, so dass am Boden haftendes Virusmaterial nicht so leicht vom Wind transportiert werden kann.

## Frühwarnsystem etabliert

Als Schlussfolgerung aus der Arbeit am Kriterienkatalog entwickelte die Arbeitsgruppe für den Winter 2021/2022 ein AI-Monitoring, eine Art Frühwarnsystem, mit welchem die Viruslast in einem Putenbestand frühzeitig erkannt und Sekundärausbrüche verhindert oder eingedämmt werden sollen. Das Monitoring wurde im Zeitraum 1. November 2021 bis 30. April 2022 für den Landkreis Cloppenburg installiert. Dafür wurden in Privatlaboren regelmäßig zweimal wöchentlich Tränkewasser- und Falltierproben (gute frischtote Tiere) untersucht. Neben der privatwirtschaftlichen Beprobung der frischtoten Falltiere und des Tränkewassers beteiligte sich der Landkreis Cloppenburg mit ca. 20 Betrieben ebenfalls am AI-Monitoring. Dieses Probenmaterial wurde im Zeitraum vom 13. Dezember 2021 bis 31. März 2022 im Landeslabor des LAVES untersucht.

## Größeres Sekundärgeschehen vermieden

Die Betriebsproben im Winter 2021/22 ergaben 117 AI-positive Fälle. Durch die Beprobung des Tränkewassers konnte ein H5-Geschehen frühzeitig erkannt und durch die Merzung des Tierbestandes ein größeres Sekundärgeschehen vermieden werden. Zudem wurde ein H6-Geschehen in der Region sichtbar, das sich in dem Beprobungsgebiet ausgebreitet hatte. Daneben wurde mit H9 ein weiterer Subtyp diagnostiziert.

Im Ergebnis bleibt festzuhalten, dass sich das AI-Monitoring beim Tränkewasser bewährt hat und Influenza- A-Viren frühzeitig detektiert werden können. Es ist eine zuverlässige und einfach zu handhabende Methode für die Tierhalter und kann dazu beitragen, ein größeres AI-Sekundärgeschehen zu verhindern.",2022-08-25,,,,4,high,,2026-05-29T09:44:15.895875+00:00,2026-05-29T09:44:15.895875+00:00
15,gefluegelnews,Aktuelle Desinfektionsrichtlinie für Tierseuchen online,https://www.gefluegelnews.de/article/aktuelle-desinfektionsrichtlinie-fur-tierseuchen-online,The report discusses updated disinfection guidelines for animal diseases rather than an active outbreak.,"# Aktuelle Desinfektionsrichtlinie für Tierseuchen online

**Seit Ende März steht die aktuelle Desinfektionsmittelrichtlinie für Tierseuchen des Friedrich-Loeffler-Instituts (Richtlinie über Mittel und Verfahren für die Durchführung der Desinfektion bei bestimmten Tierseuchen) auf der Internetseite des FLI zur Verfügung. Die aktualisierten Dokumente lösen die bis Mitte März 2023 bestehenden Empfehlungen des FLI ab.**

In der neuen Desinfektionsmittelrichtlinie hat das FLI die Kapitel zur Desinfektion von Räumen und Flächen, Einrichtungen, Gegenständen, Materialien und Fahrzeugen aktualisiert und neue Kapitel, zum Beispiel zu Lüftungs- und Biogasanlagen oder Flüssigmist, eingefügt. Mit der Aktualisierung stehen die Dokumente nun auch barrierefrei zur Verfügung.",2023-04-03,,,,1,low,,2026-05-29T09:44:18.718061+00:00,2026-05-29T09:44:18.718061+00:00
16,gefluegelnews,Aktuelle Forschungsergebnisse aus den USA: Wie werden Hühner widerstandsfähiger gegen Vogelgrippe?,https://www.gefluegelnews.de/article/aktuelle-forschungsergebnisse-aus-den-usa-wie-werden-huhner-widerstandsfahiger-gegen-vogelgrippe,The report discusses scientific research on genetic resistance to avian influenza rather than an active outbreak.,"# Aktuelle Forschungsergebnisse aus den USA: Wie werden Hühner widerstandsfähiger gegen Vogelgrippe?

**US-Wissenschaftler erforschen Möglichkeiten, um Hühner widerstandsfähiger gegen die Vogelgrippe zu machen. Indem sie untersuchen, wie einzelne Zellen des Huhns auf das Virus reagieren, hoffen sie, neue Erkenntnisse zu gewinnen. Dabei setzen sie die so genannte Einzelzelltechnologie ein, bei der jede Zelle einzeln betrachtet wird, um im Detail zu verstehen, was bei einer Infektion passiert.**

## US-Forschung: Konzentration auf genetische Widerstandsfähigkeit gegen die Vogelgrippe

Die Forschungsergebnisse wurden kürzlich auf dem Kongress der Poultry Science Association vorgestellt. Professor Wesley Warren von der Universität von Missouri berichtete dort über seine Studie an Lungen- und Immunzellen von Hühnern. Diese sind wichtig, weil das Vogelgrippevirus in der Regel in den Atemwegen, insbesondere in der Lunge, beginnt. Die Studie befasst sich hauptsächlich mit den Lungenzellen, über die das Virus in den Körper gelangt, und mit den Immunzellen, die das Virus bekämpfen.

## Gamma-Delta-T-Zellen: Welche Rolle spielen sie bei der Bekämpfung der Vogelgrippe?

Bestimmte Immunzellen, so genannte Gamma-Delta-T-Zellen, kommen bei Hühnern häufiger vor als bei Menschen. Warren glaubt, dass diese Zellen eine wichtige Rolle bei der Bekämpfung der Vogelgrippe spielen könnten. Das Team untersucht, wie sich diese T-Zellen im Körper des Huhns entwickeln. Außerdem untersuchen sie Gene in Lungenzellen, die das Virus stoppen könnten, sobald es eindringt, noch bevor das Immunsystem etwas unternimmt. Das könnte eine neue Form des Schutzes sein.

Um herauszufinden, welche Gene genau diesen Schutz bieten, will das Team CRISPR einsetzen. Dabei handelt es sich um eine Technik, die eine sehr gezielte Veränderung von kleinen DNA-Stücken ermöglicht. Auf diese Weise können Hühner gezüchtet werden, die resistenter gegen Krankheiten sind, ohne dass fremde DNA hinzugefügt wird.

## CRISPR: In den USA zugelassen

In den Vereinigten Staaten wird CRISPR bereits in der Landwirtschaft eingesetzt, während es in Europa nicht zugelassen ist. CRISPR gilt hier immer noch als genetische Veränderung (GVO), auch wenn keine fremde DNA beteiligt ist. Daher gelten bestimmte Vorschriften, und die kommerzielle Nutzung in der Geflügelzucht ist noch nicht erlaubt.

Laut Warren besteht das Ziel der Studie darin, wichtige Gene zu finden, die später weiter untersucht werden können. Auf diese Weise wollen die Forscher besser verstehen, wie diese Gene genau funktionieren und was Hühner wirklich resistent gegen die Vogelgrippe macht.",2025-08-05,,,,6,low,,2026-05-29T09:44:20.478690+00:00,2026-05-29T09:44:20.478690+00:00
