id,source,title,url,teaser,body,report_date,admin_level_1,admin_level_2,admin_level_3,relevance_score,relevance_score_string,distance_km,created_at,updated_at
22,gefluegelnews,Angriffe gegen die Geflügel-Tierseuchenkasse,https://www.gefluegelnews.de/article/angriffe-gegen-die-geflugel-tierseuchenkasse,The report focuses on administrative issues regarding a new poultry disease fund in Rhineland-Palatinate rather than an active outbreak.,"# Angriffe gegen die Geflügel-Tierseuchenkasse

**Rheinland-Pfalz ist das letzte Bundesland, in dem eine Geflügel-Tierseuchenkasse eingerichtet wurde. Sie ging zum Jahresanfang an den Start. Mitarbeitende erleben seitdem Unfassbares: Sie werden beschimpft und bedroht. Der Geflügelwirtschaftsverband Rheinland-Pfalz distanziert sich ausdrücklich.**

Es ist kaum zu fassen: Seit Versendung der Informationen zur Geflügelkasse und der Aufforderung zur Tierzahlmeldung sind in Rheinland-Pfalz mehr als tausend, teilweise beleidigende Beschwerden bei der Tierseuchenkasse eingegangen. Mitarbeiterinnen und Mitarbeiter werden telefonisch beschimpft.

Auf der jüngsten Mitgliederversammlung des Geflügelwirtschaftsverbandes (GWV) Rheinland-Pfalz e.V. in Koblenz kamen diese Vorfälle zur Sprache: Die Geschäftsführerin Helga Futterknecht und der Vorstand unter dem Vorsitzenden Guido Andres distanzierten sich ausdrücklich von dem unakzeptablen Verhalten. Sie gehen allerdings davon aus, dass dafür keine Mitglieder ihres Verbandes verantwortlich sind. Der GWV betont in diesem Zusammenhang, dass eine respektvolle und konstruktive Diskussion im Interesse aller Beteiligten liege.

## Geflügelkasse neu in Rheinland-Pfalz

Rheinland-Pfalz hatte zum Jahresbeginn 2025 eine Geflügelkasse bekommen – als letztes Bundesland. Damit unterliegen alle Geflügelhalter nun auch in Rheinland-Pfalz der gesetzlichen Melde- und Beitragspflicht. Künftig muss zum 1. Januar eines jeden Jahres der durchschnittliche Jahresbestand an Geflügel an die Tierseuchenkasse gemeldet werden. Mit den zu zahlenden Beiträgen werden bekanntlich Rücklagen für Entschädigungen und Beihilfen im Seuchenfall gebildet.

Hintergrund ist zum einen, dass die Anzahl gehaltenen Geflügels in Rheinland-Pfalz in den vergangenen Jahren deutlich zugenommen hat. Außerdem ist das Vogelgrippe-Risiko gestiegen. Bislang ist Rheinland-Pfalz diesbezüglich recht glimpflich davongekommen. Wie Helga Futterknecht informierte, hatte es Anfang Januar diesen Jahres einen Fall in einer Hobbyhaltung gegeben, 2024 gab es keine Fälle, 2022/23 waren acht Bestände betroffen gewesen.

## Fehlende Zahlen an Tierseuchenkasse melden

Laut der GWV-Geschäftsführerin sind noch nicht alle landwirtschaftlichen Geflügelbetriebe der Meldepflicht nachgekommen. Sie führt das jedoch darauf zurück, dass diese erst gerade neu eingeführt wurde. Sie ermahnte dazu, noch fehlende Meldungen durchzuführen. Sonst könnte es im Seuchenfall Probleme mit Entschädigungszahlungen geben. Die Meldung kann ganz einfach per Mail erfolgen.

Der GWV Rheinland-Pfalz hat aktuell 85 Mitglieder, gehalten werden unter anderem rund 1 Mio. Legehennen. Helga Futterknecht legte den Mitgliedern zur Weiterbildung das Netzwerk „Fokus Tierwohl“ ans Herz. Auf dem Internet-Auftritt sind zahlreiche praxisnahe Beiträge und Videos zur Geflügelhaltung zu finden, die zum Beispiel auch für Mitarbeitende auf dem Betrieb interessant sind.

Der Landesverband plant auch in diesem Jahr wieder eine Studienfahrt. Es soll in die Niederlande gehen in die Region `s-Hertogenbosch und Breda. Besucht werden soll unter anderem die Firma Vencotec. 2024 gab es eine Fahrt ins Elsass.

## BVEi finanziert Projekt zu Emissionsminderung

Zu Beginn der Mitgliederversammlung hatte Wolfgang Schleicher, Geschäftsführer des Zentralverbandes der Deutschen Geflügelwirtschaft (ZDG) online unter anderem über ein neues Projekt zum Thema TA Luft informiert: Laut TA-Luft müssen in größeren Geflügelställen Ammoniakemissionen deutlich gesenkt werden. Als günstigere Alternative zur Abluftreinigung hat sich eine Einstreulösung gezeigt, die Ammoniak im Stall reduzieren kann („ImproBed“). In Hähnchenställen schon erfolgreich erprobt und von der DLG zertifiziert, wird sie jetzt im Auftrag des BVEi in Legehennenställen (mit dreimaligem Kotbandabdrehen) auf ihr Minderungspotenzial getestet. Die Vorversuche hierfür seien abgeschlossen, so Schleicher.

In interessanten Fachvorträgen auf der Mitgliederversammlung ging es unter anderem um die Ursachen von Eischalendeformationen, Stand bei der TA Luft und alternative energetische Konzepte, mit denen Betriebe nachhaltiger werden und gleichzeitig Geld sparen können.",2025-03-14,,,,2,low,,2026-05-29T09:44:53.697193+00:00,2026-05-29T09:44:53.697193+00:00
23,gefluegelnews,Appell: Flexible Lösungen in der Landwirtschaft unterstützen!,https://www.gefluegelnews.de/article/appell-flexible-losungen-in-der-landwirtschaft-unterstutzen,The report mentions a recent culling of a goose breeding stock due to avian influenza (Vogelgrippe) in Germany.,"# Appell: Flexible Lösungen in der Landwirtschaft unterstützen!

**Wo stehen Sie mit Ihrem Betrieb heute? Wo drückt der Schuh am meisten? Wo würden Sie Ihr Unternehmen in einem Jahr gern sehen und wo ergeben sich Entwicklungschancen für Ihren Betrieb? Und was sollte in der Agrarpolitik passieren, damit sich die Entwicklung in der Geflügelwirtschaft in die richtige Richtung dreht? Das haben wir Anfang Januar einige Geflügelhalter und Geflügelhalterinnen gefragt. In diesem Video teilt Iris Tapphorn vom Gänsehof Tapphorn aus Lohne Ihre Gedanken zum Thema „Betriebsperspektive“ mit uns.**

„Unser Alltag hat, politisch gesehen, gerade sehr viele Hürden“, sagt Gänseelterntierzüchterin Iris Tapphorn. Auf ihrem Hof in Lohne, auf dem sie eine Komplettvermarktung rund um die Gans betreibt – von den Elterntieren über die Zucht, EU-Brüterei, EU-Schlachterei, Mast, Federverarbeitung bis zum Hofladen – hat die 39-jährige Landwirtin vor kurzem die Keulung ihres Elterntierbestandes durchmachen müssen. Nun kämpft sie für eine angemessene Entschädigung des Bestandes und ist von der grünen Landwirtschaftspolitik enttäuscht. Leider behindere die Politik derzeit das Wirtschaften auf dem familiengeführten Gänsehof ziemlich stark, moniert die engagerte Gänsezüchterin. „Anstatt uns zu behindern, sollte uns die Politik unterstützen“, sagt sie. „Denn wir setzen seit langem aus eigenem Antrieb das um, was von der Politik gefordert wird - auch ohne Borchert-Kommission. Ich wünsche mir, dass ich im Jahr 2023 nicht zusätzlich beschwert werde – mit noch mehr Aktenordnern an der Wand.“",2023-02-04,,,,2,medium,,2026-05-29T09:45:10.835356+00:00,2026-05-29T09:45:10.835356+00:00
24,gefluegelnews,April 2024: Vogelgrippe und Putenhaltung im Rampenlicht,https://www.gefluegelnews.de/article/april-2024-vogelgrippe-und-putenhaltung-im-rampenlicht,The report discusses ongoing large-scale vaccination campaigns and disease control efforts for highly pathogenic avian influenza in France.,"# April 2024: Vogelgrippe und Putenhaltung im Rampenlicht

**Am Ende des Jahres ist es an der Zeit, zurückzublicken. Was ist im vergangenen Jahr passiert, womit haben wir uns beschäftigt oder wofür haben wir uns interessiert. Auf geflügelnews.de werfen wir noch einmal ein Auge auf die wichtigsten Ereignisse des Jahres 2024.**

Im April 2024 zeigte sich weiter die Dringlichkeit, der Klassischen Geflügelpest weltweit konsequent zu begegnen. Frankreich erzielte erste Fortschritte in der Prävention, die USA stehen vor großen Herausforderungen durch die Vogelgrippe. In Deutschland könnte das Urteil zur Putenhaltung langfristige Änderungen anstoßen.

## Frankreich: Erfolge bei der Geflügelpest-Impfkampagne

Frankreichs Impfkampagne gegen die Geflügelpest zeigt Wirkung. Seit Beginn der Maßnahmen wurden über 21 Millionen Enten geimpft, bis September sollen es 64 Millionen sein. Die Zahl der Seuchenfälle in Nutztierhaltungen ging spürbar zurück. Die Europäische Behörde für Lebensmittelsicherheit (EFSA) sieht Impfungen als Ergänzung zu Biosicherheitsmaßnahmen. Ein begleitendes Überwachungsprogramm ist unerlässlich, um Seuchenfreiheit sicherzustellen und den Handel mit Geflügelprodukten abzusichern.

## USA: 2 Millionen Hühner durch Vogelgrippe betroffen

In Texas wurde ein Betrieb von Cal-Maine Foods, dem größten Eierproduzenten der USA, Opfer des hochpathogenen Vogelgrippevirus. Zwei Millionen Legehennen mussten gekeult werden. Bereits zuvor hatte das Virus sieben Milchviehbetriebe in der Region erreicht. Die Ausbrüche machen die Vogelgrippe zur größten landwirtschaftlichen Herausforderung der USA in diesem Monat.

## Deutschland: Urteil zur Putenhaltung stellt Standards infrage

In einem wegweisenden Urteil erklärte der Verwaltungsgerichtshof Baden-Württemberg die Puteneckwerte von 2013 als unzureichend für artgerechte Haltung. Anlass war eine Klage eines Tierschutzvereins gegen einen Putenbetrieb in Schwäbisch-Hall. Das Gericht fordert neue Standards, die den Bedürfnissen der Tiere besser entsprechen, und stellt die bisherigen Haltungsmodalitäten infrage.",2024-12-19,,,,3,high,,2026-05-29T09:45:11.766274+00:00,2026-05-29T09:45:11.766274+00:00
25,gefluegelnews,Arbeitsgruppe Geflügel: Landvolk Niedersachsen schafft neue Plattform,https://www.gefluegelnews.de/article/arbeitsgruppe-geflugel-landvolk-niedersachsen-schafft-neue-plattform,"The text mentions avian influenza only in the context of a successful past winter season due to hygiene measures, with no active outbreak reported.","# Arbeitsgruppe Geflügel: Landvolk Niedersachsen schafft neue Plattform

**Die Stimmung bei Geflügelmästern ist zurzeit gut: „Geflügelfleisch ist im Aufwind“, freut sich auch Putenhalter Christoph Klomburg aus dem niedersächsischen Syke. Beim Landvolk Niedersachsen wurde jetzt eine neue Arbeitsgruppe Geflügel gegründet. Christoph Klomburg ist der Vorsitzende.**

## Christoph Klomburg übernimmt Vorsitz der neuen AG Geflügel

Christoph Klomburg bewirtschaftet in Syke im niedersächsischen Landkreis Diepholz einen Betrieb mit Putenmast. Er ist Vorsitzender der neu gegründeten Arbeitsgruppe (AG) Geflügel im Landvolk Niedersachsen. Dort wollen sich Geflügelhalter aus Niedersachsen regelmäßig austauschen, um ihre Anliegen dann in den Fachausschuss des Deutschen Bauernverbands einzubringen. Dort ist Klomburg ebenfalls Vorsitzender.

Zurzeit ist die Stimmung gut: „Geflügelfleisch ist im Aufwind“, freut er sich. Besonders Hähnchenfleisch werde zunehmend nachgefragt. Der Marktbericht des Deutschen Bauernverbands belegt diesen Trend: „Der Pro-Kopf-Verbrauch stieg von 2023 auf 2024 um ein Kilogramm auf 20,9 kg“, heißt es dort. Der Putenfleischmarkt liegt gleichbleibend bei 4,6 kg pro Kopf und Jahr.

## Wenig Geflügelpestfälle dank strenger Hygienemaßnahmen

„Die Haltung der Puten ist anspruchsvoll“, sagt Klomburg, dessen Familie sich seit mehr als 30 Jahren mit diesen Tieren beschäftigt. Besonders froh ist er, dass Niedersachsen in Bezug auf die Geflügelpest bislang glimpflich durch den Winter gekommen ist. „Es haben sich alle an die strengen Hygienemaßnahmen gehalten“, ist der Tierhalter erleichtert.

Klomburg beteiligt sich an der Initiative Tierwohl, das entspricht der Haltungsstufe 2 des Handels. „Neben dem zusätzlichen Platz und den Außenklimareizen kommen ab diesen Sommer Strohballen als Aufsitzmöglichkeit dazu, um den Stall noch besser zu strukturieren“, plant der 42-jährige.

## Umbau auf höhere Haltungsstufen gut abwägen

Weitere Schritte, die mit mehr Bauaufwand und zusätzliche Genehmigungen verbunden seien, wie ein Wintergarten oder sogar Auslauf, müssten in Ruhe abgewogen werden. „Dafür muss erst der Absatz gesichert sein“, stellt Klomburg klar. Derzeit stamme 90 Prozent des Geflügelfleischs aus Haltungsstufe 2. In Kantinen oder Restaurants werde jedoch leider meistens noch nicht die Haltungsstufe ausgezeichnet, sodass dort zum Teil auch günstigere Importe zum Einsatz kämen.

## Nachhaltigkeit in der Geflügelhaltung: Effizienz als Vorteil

Neben dem Wohl der Tiere ist dem Landwirt die Klimabilanz seiner Arbeit wichtig. „Das ist ein großes Pfund, mit dem Geflügelhaltung wuchern kann“, sagt Klomburg. Denn pro Kilogramm Fleisch brauchen Hähnchen und Co weniger Futter als andere Tierarten. „Effizienz ist gleichbedeutend mit klimaschonend“, lautet seine Einschätzung.

Darüber hinaus ist sein Ziel, dass die Kreisläufe auf seinem Hof rund laufen. Er füttert den eigenen Weizen, streut mit dem eigenen Stroh ein und verteilt den Mist im Anschluss wieder auf seinen Äckern. Der Strom wird auf den Dächern des Stalls mittels Photovoltaikanlage produziert. „Nur bei der Wärme sind wir noch nicht autark“, bedauert Klomburg. Denn in der vierwöchigen Aufzucht brauchen Putenküken kuschelig warm.",2025-03-18,,,,1,low,,2026-05-29T09:45:13.612606+00:00,2026-05-29T09:45:13.612606+00:00
26,gefluegelnews,ASP: Droht Flächenbrand in Hessen?,https://www.gefluegelnews.de/article/asp-droht-flachenbrand-in-hessen,African swine fever is a highly contagious and economically devastating disease for the pig industry.,"# ASP: Droht Flächenbrand in Hessen?

**Was die Geflügelhaltung aus leidvoller Erfahrung mit der Geflügelpest kennt, droht nun auch in der Schweinehaltung: In Hessen sind zwei weitere Hausschweinebestände mit der Afrikanischen Schweinepest (ASP) infiziert worden. Droht auch dort ein Flächenbrand?**

Der erste ASP-Fall in Hessen war Mitte Juni bei einem Wildschwein im Kreis Groß-Gerau festgestellt worden. In Folge gab es mit den nun bekannt gewordenen neuen Fällen insgesamt vier Ausbrüche in Hausschweinebeständen in diesem Landkreis.

Aufgrund der aktuellen Lage forderte das hessische Landwirtschaftsministerium alle schweinehaltenden Betriebe in der Region auf, ihre Bestände täglich auf Krankheitserscheinungen hin zu untersuchen und diese ggf. umgehend dem Veterinäramt des Kreises zu melden.

Die wiederholten Ausbrüche in Hausschweinebeständen sind regional stark konzentriert und verdeutlichen die enorm hohe Viruslast in dem Gebiet, schreibt das Landwirtschaftsministerium. Den Behörden sei es bisher gut gelungen, eine Verschleppung in angrenzende Regionen zu verhindern. Deshalb ist es so wichtig, dass die gesamte Bevölkerung sich an die geltenden Restriktionen halte, um das Seuchengeschehen auch künftig möglichst regional zu begrenzen.

## Hessen seit Juni im Kampf gegen ASP

Der erste ASP-Fall in Hessen war Mitte Juni bei einem Wildschwein im Kreis Groß-Gerau festgestellt worden. Seitdem findet dort eine großangelegte Kadaversuche statt, um ein sogenanntes Kerngebiet des Geschehens sowie eine Infizierte Zone festzulegen. Elektrozäune entlang des Kerngebiets sollen die Wanderung infizierter oder erkrankter Tiere nach außen verhindern. Rund 17.000 Hektar wurden bereits von mit speziellen Kadaversuchhunden und Drohnen ausgestatteten Suchtrupps abgesucht. Bislang wurden dabei 43 positiv getestete Kadaver entdeckt.",2024-07-24,,,,4,high,,2026-05-29T09:45:14.583971+00:00,2026-05-29T09:45:14.583971+00:00
27,gefluegelnews,Auch bei Puten: Stress schlägt auf den Magen,https://www.gefluegelnews.de/article/auch-bei-puten-stress-schlagt-auf-den-magen,The text is a general advisory article on turkey gut health and management practices rather than a report on a specific disease outbreak.,"# Auch bei Puten: Stress schlägt auf den Magen

**Ein gesunder Darm und eine optimale Fütterung sind auch bei Puten die besten Voraussetzungen für Wohlbefinden und für hohe Leistungen. Nicht anders als beim Menschen, ist Stress einer der Hauptgründe für eine gestörte Darmflora. Putenhalterinnen und -halter können gegensteuern.**

Die Gemeinschaft der Mikroorganismen im Darm nennt man Darmflora. Dazu gehören Bakterien, Pilze, Viren und Einzeller. Die Zusammensetzung der Darmflora variiert je nach Tieralter und Darmabschnitt. Störungen der Darmflora (Dysbiosen) können viele Ursachen haben:

Infektionserreger des Darms (Viren, Bakterien, Parasiten, Pilze) können das Darmepithel zerstören, Toxine bilden und zu Entzündungen und gestörter Peristaltik des Darms führen. Dies verursacht auch Verschiebungen in der Zusammensetzung der Darmflora. Daher ist die Einhaltung von Biosicherheit auch in Hinblick auf die Darmgesundheit von Bedeutung.

Neben Infektionserregern können auch andere Faktoren wie beispielsweise Futterwechsel, schlechte Futterqualität, Mykotoxine in der Einstreu oder schlechtes Stallklima zu Störungen im Darm führen. „Der Hauptfaktor für eine gestörte Darmflora ist Stress“, betont Geflügelfachtierarzt Dr. Ronald Günther.

## Darmflora wieder im Gleichgewicht

Doch wie kann man die Darmgesundheit bei Problemen wieder ins Gleichgewicht bringen? Verschiedene Futterzusatzstoffe wie Enzyme, Pro-/ Präbiotika, phytogene Stoffe und immunologisch aktive Substanzen haben positive Effekte auf die Darmflora. Gegeben über das Futter, das Wasser oder die Einstreu können diese Produkte den Aufbau einer stabilen Darmflora (präventiv) fördern. Dr. Hartmut Meyer, Moorgut Kartzfehn, nennt ergänzend hierzu aus der Praxis Lignocellulosen, Gesteinsmehle oder Pflanzenkohle.

Ebenso kann die Darmgesundheit durch verschiedene Managementmaßnahmen des Mästers beeinflusst werden: Eine ständige Verfügbarkeit von Futter ist notwendig, damit kein Stress bei den Puten entsteht. Zwangspausen in der Fütterung, etwa während Impfaktionen, müssen unbedingt verhindert werden. Die Einstreu- sowie die Tränkwasserhygiene, Futterlagerung und Silohygiene spielen dabei eine wichtige Rolle.

## Serviceperiode ist enorm wichtig

Auch die All-in-/all-out-Strategie kann einen positiven Einfluss auf die Darmgesundheit haben. Der Stall kann in der Serviceperiode gereinigt und desinfiziert werden. Für Viren und Bakterien sollten DVG-geprüfte Desinfektionsmittel verwendet werden. Wichtig zu beachten ist, dass Parasiten im Stall extra bekämpft werden müssen.

Vier Fähigkeiten machen laut Dr. Hartmut Meyer eine gute Darmgesundheit aus:

Der Verdauungstrakt eines Vogels ist bezogen auf die Lebendmasse sehr klein. Das Futter hat dadurch nur eine kurze Verweildauer im Verdauungstrakt. Daher sind Futtermittel mit hoher Nährstoffdichte und guter Verdaulichkeit erforderlich. Dem Geflügel fehlt das Enzym Lactase und die Saccharase-Aktivität ist sehr gering. Deswegen können bestimmte Kohlenhydrate nur eingeschränkt verdaut werden.

## Nicht zu viel Fett für Küken

In den ersten Lebenswochen können Küken Fette mit gesättigten Fettsäuren nur schlecht verwerten. Nach dem Schlupf sollte daher auf einen begrenzten Fetteinsatz geachtet werden. Andernfalls können die Küken Durchfall oder Rachitis bekommen. Die Einstreu wird nass, es kann zu Kot- und Einstreufressen oder einer erhöhten Mortalität kommen.

Sowohl in der Aufzucht als auch in der Mast sollten bei der Futterzusammensetzung verschiedene Faktoren beachtet werden. Erhöhte Gehalte an Zellwandsubstanzen im Futter (Rohfaser) können die Verdaulichkeit reduzieren. Ebenso wirken sich hohe Anteile langkettiger Fettsäuren und antinutritiver Inhaltsstoffe wie Nicht-Stärke-Polysaccharide negativ auf die Verdaulichkeit aus. Gesteigert werden kann die Futterverdaulichkeit durch die Zugabe von Grit, NSP-Enzymen und Phytase.

## Weizenzufütterung mit positiven Effekten

Die Zufütterung von Weizen hat ebenfalls einen positiven Effekt auf die Darmgesundheit. Der Muskelmagen wird um 3 bis 5 Prozent vergrößert, die Sekretion von Magensäure und Pepsin wird erhöht, die aktive und passive Verdauung verbessert und die Darmperistaltik stimuliert. Somit kann eine Weizenzufütterung helfen, Durchfallerscheinungen zu reduzieren.

Allerdings müssen Putenhalterinnen und -halter dabei auf einige hygienische Aspekte achten. Der Feuchtigkeitsgehalt des Weizens darf maximal 25 Prozent betragen, sonst besteht die Gefahr von Schimmelbildung. Auch Lagerung, Maschinenhygiene und Parasitenbefall müssen kontrolliert werden. Ebenfalls zu beachten ist die Partikelgröße des Futters. Kleine Partikelgrößen reduzieren die Verweildauer des Futters im Muskelmagen und es kommt zu ineffizienter Proteinverdauung, schlechterer Absorption und Futterverwertung. Ein hoher Mehlanteil im Futter kann zu Entzündungen im Darm führen. Dr. Hartmut Meyer empfiehlt daher für Puten die Fütterung von qualitativ hochwertigen Pellets.",2024-01-22,,,,1,low,,2026-05-29T09:45:15.480082+00:00,2026-05-29T09:45:15.480082+00:00
28,gefluegelnews,Auch Eier müssen teurer werden!,https://www.gefluegelnews.de/article/auch-eier-mussen-teurer-werden,Outbreak of avian influenza in a major egg production region in Germany.,"# Auch Eier müssen teurer werden!

**DEU Marktbericht Woche 32**

Aktuell ist der Eiermarkt am ehesten als etwas freundlicher, aber noch uneinheitlich zu beschreiben. Das kann und wird sich voraussichtlich sehr schnell ändern. Der Eiermarkt ist über Nacht für eine große Überraschung gut! Alle Anzeichen deuten darauf hin, dass wir noch sehr teure Eierpreise bekommen werden. Allem voran sind Eier immer noch sehr preiswert. Das wohl günstigste Grundnahrungsmittel mit seinen wertvollen Inhaltsstoffen ist das Produkt Ei.Wohlschmeckend und sehr nahrhaft!

Es wird höchste Zeit, dass Eier als ein sehr bedeutendes Lebensmittel auch eine entsprechende Wertschätzung erfahren. Dass Eier in der Verfügbarkeit als Selbstverständlichkeit wahrgenommen werden, könnte sich schon sehr bald ändern. Aufgrund der enormen Preissteigerungen hat die Angebotsseite verständlicherweise reagiert. Sehr deutlich sichtbar wird die Bestandsreduzierung von Legehennen anhand der Bruteierstatistik für den europäischen Raum. Das hat es in dieser Größenordnung schon sehr lange nicht mehr gegeben! Und die Reduzierung wird noch deutlich größer sein. Die in Europa zwangsweise ausgestallten Legehennen aufgrund der aviären Influenza werden nicht berücksichtigt. Und die Vogelgrippe ist immer noch allgegenwärtig. Ganz aktuell wurde ein positiver Verdachtsfall „im Herzen“ der Eierproduktion bekannt. Vorsorglich werden im niedersächsischen Landkreis Vechta mehrere Bestände geräumt. Das alles lässt nichts Gutes erahnen und der Vogelzug steht uns erst noch bevor. Braune schwere Eier sind schon jetzt nicht auffindbar. Uns wird noch eine ganz besondere Zeit bevorstehen.",2022-08-12,,,,1,high,,2026-05-29T09:45:16.449207+00:00,2026-05-29T09:45:16.449207+00:00
29,gefluegelnews,"""Auch für neue Hennenställe ist AI-Versicherung gefragt!""",https://www.gefluegelnews.de/article/auch-fur-neue-hennenstalle-ist-ai-versicherung-gefragt,The text discusses insurance coverage for potential future outbreaks rather than reporting an active outbreak.,"# ""Auch für neue Hennenställe ist AI-Versicherung gefragt!""

Thomas Brink (links) und Thomas Berling vom Versicherungsmakler Diepenbrock beim Fachgespräch Legehennen in Haselünne.

**Laut Thomas Brink und Thomas Berling vom Versicherungsmakler Diepenbrock ist eine Tier-Ertragsschadensversicherung nach wie vor ein wichtiges Thema bei neugebauten Ställen. Das betonten die beiden Spezialisten am Rande des Fachgesprächs Legehennen in Haselünne am Mittwoch (18.September 2024).**

Speziell geht es auch um die Absicherung für Ertragsausfälle bei einer Infektion mit der Geflügelpest (AI). Nach den „großen“ Geflügelpest-Zügen in Weser-Ems gab es Zeichnungsverbote der Versicherer. Heute könne man wieder vernünftige Deckungskonzepte anbieten, die jedoch sehr individuell je nach Standort zu gestalten seien, so die Fachleute.",2024-09-19,,,,1,low,,2026-05-29T09:45:17.442445+00:00,2026-05-29T09:45:17.442445+00:00
